Tên trường,Liên kết
Trường Quản Trị và Kinh Doanh - ĐH Quốc gia Hà Nội,/diem-chuan/truong-quan-tri-va-kinh-doanh-dh-quoc-gia-ha-noi-QHD.html
Trường Khoa học liên ngành và Nghệ thuật - Đại học Quốc gia Hà Nội,/diem-chuan/truong-khoa-hoc-lien-nganh-va-nghe-thuat-dai-hoc-quoc-gia-ha-noi-QHK.html
Phân hiệu Đại học Quốc gia TPHCM tại Bến Tre,/diem-chuan/phan-hieu-dai-hoc-quoc-gia-tphcm-tai-ben-tre-QSP.html
Đại Học Răng – Hàm – Mặt,/diem-chuan/dai-hoc-rang-ham-mat-RHM.html
Đại Học Quốc Tế RMIT Việt Nam,/diem-chuan/dai-hoc-quoc-te-rmit-viet-nam-RMU.html
Đại Học Quốc Tế Sài Gòn,/diem-chuan/dai-hoc-quoc-te-sai-gon-SIU.html
Đại Học Thái Bình Dương,/diem-chuan/dai-hoc-thai-binh-duong-TBD.html
Đại học Y khoa Tokyo Việt Nam,/diem-chuan/dai-hoc-y-khoa-tokyo-viet-nam-THU.html
Đại học Kiên Giang,/diem-chuan/dai-hoc-kien-giang-TKG.html
Đại Học Thủy Lợi (Cơ sở 1),/diem-chuan/dai-hoc-thuy-loi-co-so-1-TLA.html
Đại Học Thủy Lợi (Cơ sở 2),/diem-chuan/dai-hoc-thuy-loi-co-so-2-TLS.html
Đại Học Kinh Tế Tài Chính TPHCM,/diem-chuan/dai-hoc-kinh-te-tai-chinh-tphcm-UEF.html
Đại học Khánh Hòa,/diem-chuan/dai-hoc-khanh-hoa-UKH.html
Đại học Quản lý và công nghệ TPHCM,/diem-chuan/dai-hoc-quan-ly-va-cong-nghe-tphcm-UMT.html
Đại Học Việt Đức,/diem-chuan/dai-hoc-viet-duc-VGU.html
Đại học Việt Nhật - Đại học Quốc gia Hà Nội,/diem-chuan/dai-hoc-viet-nhat-dai-hoc-quoc-gia-ha-noi-VJU.html
Đại Học Võ Trường Toản,/diem-chuan/dai-hoc-vo-truong-toan-VTT.html
Phân hiệu Đại học Xây dựng miền Trung tại Đà Nẵng,/diem-chuan/phan-hieu-dai-hoc-xay-dung-mien-trung-tai-da-nang-XDN.html
Phân hiệu Đại học Y Hà Nội tại Thanh Hóa,/diem-chuan/phan-hieu-dai-hoc-y-ha-noi-tai-thanh-hoa-YHT.html
